{
  "runtimes": {
    "claude": {
      "models": [
        {
          "fields": {
            "canonicalModel": [
              {
                "confidence": "high",
                "provenance": {
                  "adapterVersion": "2",
                  "sourceId": "claude",
                  "sourceKind": "runtime",
                  "sourceVersion": "2.1.302"
                },
                "value": "claude-haiku-5-5"
              }
            ],
            "capabilities": [
              {
                "confidence": "high",
                "provenance": {
                  "sourceId": "claude-release-docs",
                  "sourceKind": "knowledge-source",
                  "sourceVersion": "sha256:974a0d16b453e9c55dab0554bb95cb80c1d53913ef90a083966da232aab045a9"
                },
                "value": {
                  "reasoning": true,
                  "tool_call": true
                }
              }
            ],
            "contextWindow": [
              {
                "confidence": "high",
                "provenance": {
                  "adapterVersion": "1",
                  "sourceId": "anthropic-models-api",
                  "sourceKind": "knowledge-source",
                  "sourceVersion": "sha256:6a05e955d6317af645a89ce55af2bdc8"
                },
                "value": 1000000
              }
            ],
            "defaultReasoningLevel": [
              {
                "confidence": "high",
                "provenance": {
                  "sourceId": "claude-release-docs",
                  "sourceKind": "knowledge-source",
                  "sourceVersion": "sha256:974a0d16b453e9c55dab0554bb95cb80c1d53913ef90a083966da232aab045a9"
                },
                "value": "medium"
              }
            ],
            "id": [
              {
                "confidence": "high",
                "provenance": {
                  "adapterVersion": "2",
                  "sourceId": "claude",
                  "sourceKind": "runtime",
                  "sourceVersion": "2.1.302"
                },
                "value": "claude-haiku-5-5"
              }
            ],
            "supportedReasoningLevels": [
              {
                "confidence": "high",
                "provenance": {
                  "sourceId": "claude-release-docs",
                  "sourceKind": "knowledge-source",
                  "sourceVersion": "sha256:974a0d16b453e9c55dab0554bb95cb80c1d53913ef90a083966da232aab045a9"
                },
                "value": [
                  {
                    "effort": "low"
                  },
                  {
                    "effort": "medium"
                  },
                  {
                    "effort": "high"
                  },
                  {
                    "effort": "xhigh"
                  },
                  {
                    "effort": "max"
                  }
                ]
              }
            ]
          },
          "model": "claude-haiku-5-5"
        },
        {
          "fields": {
            "canonicalModel": [
              {
                "confidence": "high",
                "provenance": {
                  "adapterVersion": "2",
                  "sourceId": "claude",
                  "sourceKind": "runtime",
                  "sourceVersion": "2.1.302"
                },
                "value": "claude-opus-5-5"
              }
            ],
            "capabilities": [
              {
                "confidence": "high",
                "provenance": {
                  "sourceId": "claude-release-docs",
                  "sourceKind": "knowledge-source",
                  "sourceVersion": "sha256:974a0d16b453e9c55dab0554bb95cb80c1d53913ef90a083966da232aab045a9"
                },
                "value": {
                  "reasoning": true,
                  "tool_call": true
                }
              }
            ],
            "contextWindow": [
              {
                "confidence": "high",
                "provenance": {
                  "adapterVersion": "1",
                  "sourceId": "anthropic-models-api",
                  "sourceKind": "knowledge-source",
                  "sourceVersion": "sha256:6a05e955d6317af645a89ce55af2bdc8"
                },
                "value": 1000000
              }
            ],
            "defaultReasoningLevel": [
              {
                "confidence": "high",
                "provenance": {
                  "sourceId": "claude-release-docs",
                  "sourceKind": "knowledge-source",
                  "sourceVersion": "sha256:974a0d16b453e9c55dab0554bb95cb80c1d53913ef90a083966da232aab045a9"
                },
                "value": "medium"
              }
            ],
            "id": [
              {
                "confidence": "high",
                "provenance": {
                  "adapterVersion": "2",
                  "sourceId": "claude",
                  "sourceKind": "runtime",
                  "sourceVersion": "2.1.302"
                },
                "value": "claude-opus-5-5"
              }
            ],
            "supportedReasoningLevels": [
              {
                "confidence": "high",
                "provenance": {
                  "sourceId": "claude-release-docs",
                  "sourceKind": "knowledge-source",
                  "sourceVersion": "sha256:974a0d16b453e9c55dab0554bb95cb80c1d53913ef90a083966da232aab045a9"
                },
                "value": [
                  {
                    "effort": "low"
                  },
                  {
                    "effort": "medium"
                  },
                  {
                    "effort": "high"
                  },
                  {
                    "effort": "xhigh"
                  },
                  {
                    "effort": "max"
                  }
                ]
              }
            ]
          },
          "model": "claude-opus-5-5"
        },
        {
          "fields": {
            "canonicalModel": [
              {
                "confidence": "high",
                "provenance": {
                  "adapterVersion": "2",
                  "sourceId": "claude",
                  "sourceKind": "runtime",
                  "sourceVersion": "2.1.302"
                },
                "value": "claude-sonnet-5-5"
              }
            ],
            "capabilities": [
              {
                "confidence": "high",
                "provenance": {
                  "sourceId": "claude-release-docs",
                  "sourceKind": "knowledge-source",
                  "sourceVersion": "sha256:974a0d16b453e9c55dab0554bb95cb80c1d53913ef90a083966da232aab045a9"
                },
                "value": {
                  "reasoning": true,
                  "tool_call": true
                }
              }
            ],
            "contextWindow": [
              {
                "confidence": "high",
                "provenance": {
                  "adapterVersion": "1",
                  "sourceId": "anthropic-models-api",
                  "sourceKind": "knowledge-source",
                  "sourceVersion": "sha256:6a05e955d6317af645a89ce55af2bdc8"
                },
                "value": 1000000
              }
            ],
            "defaultReasoningLevel": [
              {
                "confidence": "high",
                "provenance": {
                  "sourceId": "claude-release-docs",
                  "sourceKind": "knowledge-source",
                  "sourceVersion": "sha256:974a0d16b453e9c55dab0554bb95cb80c1d53913ef90a083966da232aab045a9"
                },
                "value": "medium"
              }
            ],
            "id": [
              {
                "confidence": "high",
                "provenance": {
                  "adapterVersion": "2",
                  "sourceId": "claude",
                  "sourceKind": "runtime",
                  "sourceVersion": "2.1.302"
                },
                "value": "claude-sonnet-5-5"
              }
            ],
            "supportedReasoningLevels": [
              {
                "confidence": "high",
                "provenance": {
                  "sourceId": "claude-release-docs",
                  "sourceKind": "knowledge-source",
                  "sourceVersion": "sha256:974a0d16b453e9c55dab0554bb95cb80c1d53913ef90a083966da232aab045a9"
                },
                "value": [
                  {
                    "effort": "low"
                  },
                  {
                    "effort": "medium"
                  },
                  {
                    "effort": "high"
                  },
                  {
                    "effort": "xhigh"
                  },
                  {
                    "effort": "max"
                  }
                ]
              }
            ]
          },
          "model": "claude-sonnet-5-5"
        },
        {
          "fields": {
            "canonicalModel": [
              {
                "confidence": "high",
                "provenance": {
                  "adapterVersion": "2",
                  "sourceId": "claude",
                  "sourceKind": "runtime",
                  "sourceVersion": "2.1.302"
                },
                "value": "claude-haiku-5-5"
              }
            ],
            "capabilities": [
              {
                "confidence": "high",
                "provenance": {
                  "sourceId": "claude-release-docs",
                  "sourceKind": "knowledge-source",
                  "sourceVersion": "sha256:974a0d16b453e9c55dab0554bb95cb80c1d53913ef90a083966da232aab045a9"
                },
                "value": {
                  "reasoning": true,
                  "tool_call": true
                }
              }